{
  "schemaVersion": 1,
  "runId": "codex-publication-baseline-2026-08-07",
  "title": "building the coding agent tips site with codex",
  "label": "site launch",
  "status": "partial",
  "product": "codex",
  "productVersion": "0.146.0",
  "model": null,
  "surface": "codex desktop",
  "baseCommit": "60aa685374688fbe34194478c49661ae1597032b",
  "taskSpecification": "https://github.com/anipotts/coding-agent-tips/blob/main/docs/field-lab/runs/codex-publication-baseline-2026-08-07/task-specification.md",
  "machineProfile": {
    "platform": "macos, darwin 25.5.0",
    "architecture": "arm64",
    "memoryGb": null,
    "notes": "memory capacity was not recorded; model inference was provider-hosted"
  },
  "startedAt": null,
  "completedAt": "2026-08-07T22:03:10.047Z",
  "scenarios": [
    {
      "id": "architecture-inspection",
      "title": "understand the existing system",
      "result": "pass",
      "elapsedSeconds": null,
      "evidence": [
        "https://github.com/anipotts/coding-agent-tips/commit/a88259c"
      ],
      "notes": "the evidence model, site architecture, repository identity, and legacy policy were recorded before the site build"
    },
    {
      "id": "planning",
      "title": "set the plan and public boundaries",
      "result": "pass",
      "elapsedSeconds": null,
      "evidence": [
        "https://github.com/anipotts/coding-agent-tips/blob/main/docs/field-lab/runs/codex-publication-baseline-2026-08-07/task-specification.md"
      ],
      "notes": "pass conditions and public-action gates were explicit before publication work"
    },
    {
      "id": "implementation",
      "title": "build the publication",
      "result": "pass",
      "elapsedSeconds": null,
      "evidence": [
        "https://github.com/anipotts/coding-agent-tips/commit/c340f65",
        "https://github.com/anipotts/coding-agent-tips/commit/184632a"
      ],
      "notes": "the signed commit adds the astro and starlight publication, active frontmatter, responsive evidence rail, and canonical route set"
    },
    {
      "id": "failure-and-recovery",
      "title": "find problems and recover",
      "result": "pass",
      "elapsedSeconds": null,
      "evidence": [
        "https://github.com/anipotts/coding-agent-tips/blob/main/docs/field-lab/runs/codex-publication-baseline-2026-08-07/checks.md"
      ],
      "notes": "schema coercion, icon integration, and generated-route link failures were found and corrected during the build loop"
    },
    {
      "id": "session-continuity",
      "title": "preserve decisions across the work",
      "result": "partial",
      "elapsedSeconds": null,
      "evidence": [
        "https://github.com/anipotts/coding-agent-tips/tree/main/docs/decisions"
      ],
      "notes": "decisions were persisted in signed commits and repository documents; resumed-session recovery remains pending"
    },
    {
      "id": "delegated-analysis",
      "title": "delegate a bounded review",
      "result": "not-run",
      "elapsedSeconds": null,
      "evidence": [],
      "notes": "subagent delegation was outside the active execution policy for this run"
    },
    {
      "id": "isolated-worktree",
      "title": "work in a separate checkout",
      "result": "not-run",
      "elapsedSeconds": null,
      "evidence": [],
      "notes": "the implementation used the existing dedicated branch and checkout; the second-worktree scenario remains pending"
    },
    {
      "id": "final-review",
      "title": "review the result",
      "result": "pass",
      "elapsedSeconds": null,
      "evidence": [
        "https://github.com/anipotts/coding-agent-tips/blob/main/docs/field-lab/runs/codex-publication-baseline-2026-08-07/design-review.md",
        "https://github.com/anipotts/coding-agent-tips/blob/main/docs/field-lab/runs/codex-publication-baseline-2026-08-07/checks.md",
        "https://github.com/anipotts/coding-agent-tips/commit/184632a",
        "https://github.com/anipotts/coding-agent-tips/commit/d6d58e5",
        "https://github.com/anipotts/coding-agent-tips/commit/18186e7"
      ],
      "notes": "the production build, canonical identity, responsive layouts, evidence behavior, and concept fidelity were reviewed; follow-up shell reviews unified the geometry and restored mobile primary navigation on standalone routes"
    }
  ],
  "operatorInterventions": 0,
  "reviewMinutes": null,
  "artifacts": [
    {
      "kind": "commit",
      "url": "https://github.com/anipotts/coding-agent-tips/commit/a88259c",
      "description": "field lab and decision record"
    },
    {
      "kind": "commit",
      "url": "https://github.com/anipotts/coding-agent-tips/commit/c340f65",
      "description": "publication implementation"
    },
    {
      "kind": "commit",
      "url": "https://github.com/anipotts/coding-agent-tips/commit/184632a",
      "description": "mobile-first field-run language and github icon revision from visual review"
    },
    {
      "kind": "commit",
      "url": "https://github.com/anipotts/coding-agent-tips/commit/d6d58e5",
      "description": "responsive publication shell and editorial density revision from desktop and mobile review"
    },
    {
      "kind": "commit",
      "url": "https://github.com/anipotts/coding-agent-tips/commit/18186e7",
      "description": "standalone mobile navigation and first-section spacing revision from the full route audit"
    },
    {
      "kind": "verification",
      "url": "https://github.com/anipotts/coding-agent-tips/blob/main/docs/field-lab/runs/codex-publication-baseline-2026-08-07/checks.md",
      "description": "sanitized command and browser check ledger"
    },
    {
      "kind": "design-review",
      "url": "https://github.com/anipotts/coding-agent-tips/blob/main/docs/field-lab/runs/codex-publication-baseline-2026-08-07/design-review.md",
      "description": "concept fidelity and responsive review ledger"
    }
  ],
  "redactions": [
    "raw conversation and tool transcripts",
    "absolute local filesystem paths",
    "machine name and account identifiers"
  ],
  "limitations": [
    "the model identifier was unavailable on the public run surface",
    "available measurements exclude start time, scenario durations, memory capacity, and review time",
    "available evidence excludes token use and cost estimates",
    "delegated analysis and a separate isolated-worktree scenario remain pending",
    "the paired current claude code run remains pending",
    "production hosting, custom-domain behavior, and github metadata are outside this local baseline"
  ]
}
