{
  "schemaVersion": 1,
  "runId": "codex-dependency-maintenance-2026-08-11",
  "title": "updating the coding agent tips toolchain with codex",
  "label": "dependency maintenance",
  "status": "partial",
  "product": "codex",
  "productVersion": "0.146.0",
  "model": null,
  "surface": "codex desktop",
  "baseCommit": "89c2008351c3bfea178173e5a91d3d16558eaf10",
  "taskSpecification": "https://github.com/anipotts/coding-agent-tips/blob/main/docs/field-lab/dependency-maintenance-specification.md",
  "machineProfile": {
    "platform": "macos, darwin 25.5.0",
    "architecture": "arm64",
    "memoryGb": 18,
    "notes": "apple silicon; dependency installation and site rendering ran locally while model inference remained provider-hosted"
  },
  "startedAt": "2026-08-11T18:13:35Z",
  "completedAt": "2026-08-11T18:25:10Z",
  "scenarios": [
    {
      "id": "architecture-inspection",
      "title": "understand the maintenance boundary",
      "result": "pass",
      "elapsedSeconds": null,
      "evidence": [
        "https://github.com/anipotts/coding-agent-tips/commit/d40fa42a2b8528b01af9a7cd85b196cd59cdf5cd",
        "https://github.com/withastro/astro/releases/tag/astro%407.2.1",
        "https://github.com/dequelabs/axe-core-npm/releases/tag/v4.13.0"
      ],
      "notes": "the run separated compatible framework and accessibility updates from the unsupported typescript major"
    },
    {
      "id": "planning",
      "title": "set the plan before changing dependencies",
      "result": "pass",
      "elapsedSeconds": null,
      "evidence": [
        "https://github.com/anipotts/coding-agent-tips/commit/d40fa42a2b8528b01af9a7cd85b196cd59cdf5cd"
      ],
      "notes": "the first public branch commit records the scope, pass conditions, and evidence limits"
    },
    {
      "id": "implementation",
      "title": "update the eligible dependencies",
      "result": "pass",
      "elapsedSeconds": null,
      "evidence": [
        "https://github.com/anipotts/coding-agent-tips/commit/98037c03bf5b47fcf393cae2878e918eacda02dc"
      ],
      "notes": "astro and axe changed at their pinned package and lockfile entries; the remaining dependency set stayed fixed"
    },
    {
      "id": "failure-and-recovery",
      "title": "respect the checker compatibility boundary",
      "result": "partial",
      "elapsedSeconds": null,
      "evidence": [
        "https://github.com/anipotts/coding-agent-tips/pull/274"
      ],
      "notes": "the run reused PR 274's recorded typescript 7 incompatibility and kept the known-good compiler"
    },
    {
      "id": "session-continuity",
      "title": "preserve the work across the maintenance cycle",
      "result": "pass",
      "elapsedSeconds": null,
      "evidence": [
        "https://github.com/anipotts/coding-agent-tips/pull/279"
      ],
      "notes": "the task specification, signed branch commits, pull request, and run record keep the decision trail in the repository"
    },
    {
      "id": "delegated-analysis",
      "title": "delegate a bounded review",
      "result": "not-run",
      "elapsedSeconds": null,
      "evidence": [],
      "notes": "delegated analysis stayed outside the active execution policy for this run"
    },
    {
      "id": "isolated-worktree",
      "title": "work in a separate checkout",
      "result": "not-run",
      "elapsedSeconds": null,
      "evidence": [],
      "notes": "the run used the existing dedicated branch and checkout"
    },
    {
      "id": "final-review",
      "title": "review the updated publication",
      "result": "pass",
      "elapsedSeconds": null,
      "evidence": [
        "https://github.com/anipotts/coding-agent-tips/pull/279/checks",
        "https://github.com/anipotts/coding-agent-tips/commit/c76d158616406d1e380fd2a3b744e3bfc30e1b67",
        "https://github.com/anipotts/coding-agent-tips/actions/runs/31522505781",
        "https://github.com/anipotts/coding-agent-tips/actions/runs/31522505644"
      ],
      "notes": "branch and main validation passed with the linux accessibility scan; Pages deployed and the production mobile review found zero overflow or console warnings and errors"
    }
  ],
  "operatorInterventions": 0,
  "reviewMinutes": null,
  "artifacts": [
    {
      "kind": "pull-request",
      "url": "https://github.com/anipotts/coding-agent-tips/pull/279",
      "description": "reviewable dependency diff, rationale, evidence, and rollout plan"
    },
    {
      "kind": "required-checks",
      "url": "https://github.com/anipotts/coding-agent-tips/pull/279/checks",
      "description": "Linux accessibility, handbook, markdown, and compatibility gates"
    },
    {
      "kind": "release-evidence",
      "url": "https://github.com/withastro/astro/releases/tag/astro%407.2.1",
      "description": "official astro 7.2.1 patch record"
    },
    {
      "kind": "release-evidence",
      "url": "https://github.com/dequelabs/axe-core-npm/releases/tag/v4.13.0",
      "description": "official axe-core npm 4.13.0 release record"
    },
    {
      "kind": "merge-commit",
      "url": "https://github.com/anipotts/coding-agent-tips/commit/c76d158616406d1e380fd2a3b744e3bfc30e1b67",
      "description": "GitHub-verified main commit for the reviewed maintenance change"
    },
    {
      "kind": "production-validation",
      "url": "https://github.com/anipotts/coding-agent-tips/actions/runs/31522505781",
      "description": "main-branch build, route, link, handbook, markdown, and accessibility checks"
    },
    {
      "kind": "pages-deployment",
      "url": "https://github.com/anipotts/coding-agent-tips/actions/runs/31522505644",
      "description": "successful custom-domain GitHub Pages deployment"
    },
    {
      "kind": "production-page",
      "url": "https://agents.anipotts.com/field-lab/runs/codex-dependency-maintenance-2026-08-11/",
      "description": "live reader-facing run with the deployed field evidence"
    }
  ],
  "redactions": [
    "raw conversation and tool transcripts",
    "absolute local filesystem paths",
    "machine name, serial number, and account identifiers",
    "environment values and secrets"
  ],
  "limitations": [
    "the model identifier was unavailable on the public run surface",
    "scenario durations and review time were not separately instrumented",
    "the typescript compatibility result reuses the recorded PR 274 failure boundary",
    "delegated analysis and a separate isolated-worktree scenario were outside this run",
    "the paired current claude code product run remains pending"
  ]
}
